{
  "schema_version": "1.2.0",
  "protocol_id": "PR01",
  "status": "ARCHIVED",
  "decision": null,
  "evidence": {
    "protocol_source": {
      "path": "protocols/PR01_literature_review.md",
        "sha256": "57C4FB842E80416EA27D6C999B2DC1A1AE223A75CB9D67D27531F800E2A4B133"
    },
    "search_manifest": {
      "path": "research/metadata/pr01_search_manifest.json",
      "sha256": "03ACA13B9437EA00F430E573FF088355BFC25301A180984319690607A9F544B9"
    },
    "raw_search_export_manifest": {
      "path": "research/metadata/pr01_raw_search_export_manifest.json",
        "sha256": "AD09B19F6BAB799B15C11BAD1DD61FB6DA1E7F9BD05206AD0CE4940FAB309CA6"
    },
    "screening_ledger": null,
    "zotero_export": {
      "path": "references/zotero/export/library.bib",
      "sha256": "62099566F10E98EDBABFD670A51BDC71E4C2F9AF59E3AC563EA640870B6F7416"
    },
    "zotero_receipt": {
      "path": "references/zotero/export/receipt.json",
      "sha256": "8DEC029BCB94B461E252FF62C2707471976B8FD26057D5BA3A3767B843BF37E6"
    },
    "nearest_work_matrix": null,
    "backward_forward_snowball_log": null,
    "correction_retraction_check": null
  },
  "review": {
    "reviewer_id": null,
    "reviewer_role": null,
    "reviewed_at": null,
    "rationale": null
  }
}

